{
  "schemaVersion": 1,
  "productID": "lengyan",
  "bookID": "lengyanjing",
  "editionID": "legacy-repository-v1",
  "contractState": "legacy-migration",
  "titles": {
    "zh-Hant": "大佛頂如來密因修證了義諸菩薩萬行首楞嚴經",
    "zh-Hans": "大佛顶如来密因修证了义诸菩萨万行首楞严经"
  },
  "canonicalLocale": "zh-Hant",
  "supportedLocales": [
    "zh-Hant",
    "zh-Hans"
  ],
  "contentVersion": "legacy-1",
  "stableIDScheme": "fuxuan-classics-v1",
  "normalization": "utf8-nfc-lf-v1",
  "sourceManifest": "source-manifest.json",
  "contentPackages": {
    "zh-Hant": "Content/content-zh-Hant.json",
    "zh-Hans": "Content/content-zh-Hans.json"
  },
  "legacyCompatibility": {
    "identifierKind": "outline-path",
    "identifierPattern": "^/(?:[A-Z][0-9]+)(?:/[A-Z][0-9]+)*$",
    "migrationStatus": "in-progress",
    "mappingArtifact": "Content/legacy-path-map.json",
    "sourceArtifacts": [
      "lengyan/data/lengyanjing-chapter-map.json",
      "lengyan/data/lengyanjing-content.json",
      "lengyan/data/lengyanjing-index-tree.json",
      "lengyan/data/lengyanjing-index.json",
      "lengyan/data/lengyanjing-media.json",
      "lengyan/data/simplified/enhanced-lengyanjing-content.json",
      "lengyan/data/simplified/lengyanjing-content.json",
      "lengyan/data/simplified/lengyanjing-index-tree.json",
      "lengyan/data/simplified/lengyanjing-index.json",
      "lengyan/data/simplified/lengyanjing-media.json"
    ]
  }
}
