{
  "schemaVersion": 1,
  "productID": "tanjing",
  "bookID": "liuzutanjing",
  "editionID": "cbeta-t48n2008-2026r1-reference",
  "contractState": "source-review",
  "titles": {
    "zh-Hant": "六祖大師法寶壇經",
    "zh-Hans": "六祖大师法宝坛经"
  },
  "canonicalLocale": "zh-Hant",
  "supportedLocales": [
    "zh-Hant",
    "zh-Hans"
  ],
  "contentVersion": "candidate-2026r1",
  "stableIDScheme": "fuxuan-classics-v1",
  "normalization": "utf8-nfc-lf-v1",
  "sourceManifest": "source-manifest.json"
}
